{
  "agent_id": "AG-000",
  "canonical_name": "REPLACE_WITH_AGENT_NAME",
  "role": "REPLACE_WITH_ROLE",
  "family": "REPLACE_WITH_FAMILY",
  "capabilities": [
    "capability.example"
  ],
  "allowed_tools": [],
  "authority_scope": [],
  "handoff_targets": [],
  "status": "HOLD",
  "version": "1.0.0",
  "provenance": {
    "source": "project.genome::v1.0.0",
    "state": "SPECIFIED"
  }
}
